<?xml version="1.0" encoding="UTF-8" standalone="no"?>
<tns:Flowers xmlns:xsi="http://www.w3.org/2001/XMLSchema-instance" xsi:schemaLocation="http://sherbakov.nure.ua/practice7/entity input.xsd" xmlns:tns="http://sherbakov.nure.ua/practice7/entity">
    <Flower>
        <Name>Rose</Name>
        <Origin>Holland</Origin>
        <VisualParameters>
            <StalkColor/>
        </VisualParameters>
        <GrovingTips>
            <Temperature>20</Temperature>
            <Lighting>true</Lighting>
            <Watering>80</Watering>
        </GrovingTips>
        <Multipling>feces</Multipling>
        <Price>15.59</Price>
    </Flower>
    <Flower>
        <Name>Hedychium</Name>
        <Origin>South Asia</Origin>
        <VisualParameters>
            <StalkColor>Green</StalkColor>
        </VisualParameters>
        <GrovingTips>
            <Temperature>27</Temperature>
            <Lighting>false</Lighting>
            <Watering>105</Watering>
        </GrovingTips>
        <Multipling>FECES</Multipling>
        <Price>12.79</Price>
    </Flower>
    <Flower>
        <Name>Thoren</Name>
        <Origin>Asia</Origin>
        <VisualParameters>
            <StalkColor/>
        </VisualParameters>
        <GrovingTips>
            <Temperature>22</Temperature>
            <Lighting>true</Lighting>
            <Watering>60</Watering>
        </GrovingTips>
        <Multipling>SEEDS</Multipling>
        <Price>16.49</Price>
    </Flower>
    <Flower>
        <Name>Kermek</Name>
        <Origin>Asia</Origin>
        <VisualParameters>
            <StalkColor/>
        </VisualParameters>
        <GrovingTips>
            <Temperature>22</Temperature>
            <Lighting>true</Lighting>
            <Watering>60</Watering>
        </GrovingTips>
        <Multipling>SEEDS</Multipling>
        <Price>20.99</Price>
    </Flower>
    <Flower>
        <Name>Abelia</Name>
        <Origin>Japan</Origin>
        <VisualParameters>
            <StalkColor/>
        </VisualParameters>
        <GrovingTips>
            <Temperature>22</Temperature>
            <Lighting>true</Lighting>
            <Watering>60</Watering>
        </GrovingTips>
        <Multipling>SEEDS</Multipling>
        <Price>20.99</Price>
    </Flower>
</tns:Flowers>
